{
  "schemaVersion": 3,
  "traceId": "9ba0222f-a852-4691-8082-c4a732cdfb97",
  "runId": "verify-20260909T065647Z-28394",
  "taskId": "verify.build",
  "providerId": "builder",
  "tools": [
    "tsc",
    "pnpm"
  ],
  "executor": "pnpm",
  "startedAt": "2026-09-09T06:56:49Z",
  "startedAtEpochMs": 1788937009244,
  "durationMs": 1549,
  "exitCode": 0,
  "context": {
    "repositoryId": "f1c573ec8d35a233",
    "worktreeId": "18180bae8c9a8c81",
    "branch": "independent-roles",
    "candidateRevision": "c8bd38d0ed71a8e6405fc245dd6dcb0fa9fe66be",
    "workspaceDigest": "sha256:e3b0c44298fc1c149afbf4c8996fb92427ae41e4649b934ca495991b7852b855",
    "dirty": false,
    "agentId": "codex-role-orchestrator"
  },
  "output": {
    "rawBytes": 785,
    "modelVisibleBytes": 202,
    "reducedBytes": 583,
    "estimatedRawTokens": 197,
    "estimatedModelVisibleTokens": 51,
    "estimatedTokensAvoided": 146,
    "tokenEstimate": {
      "method": "utf8_bytes_divided_by_4",
      "version": 1
    }
  },
  "evidence": {
    "ref": ".agent/logs/tool-9ba0222f-a852-4691-8082-c4a732cdfb97.log",
    "sha256": "a5cea61925aae2ec86ca3359d06a653d07ea5494cca87d428031213f24ec5f77",
    "redaction": {
      "mode": "default",
      "count": 0
    }
  }
}
