{
  "schemaVersion": 3,
  "traceId": "03bc2fff-f0b2-495e-bec4-3be711f510f4",
  "runId": "verify-20260909T065647Z-28394",
  "taskId": "verify.go-vet",
  "providerId": "go-vet",
  "tools": [
    "go-vet"
  ],
  "executor": "env",
  "startedAt": "2026-09-09T06:57:21Z",
  "startedAtEpochMs": 1788937041760,
  "durationMs": 161,
  "exitCode": 0,
  "context": {
    "repositoryId": "f1c573ec8d35a233",
    "worktreeId": "18180bae8c9a8c81",
    "branch": "independent-roles",
    "candidateRevision": "c8bd38d0ed71a8e6405fc245dd6dcb0fa9fe66be",
    "workspaceDigest": "sha256:e3b0c44298fc1c149afbf4c8996fb92427ae41e4649b934ca495991b7852b855",
    "dirty": false,
    "agentId": "codex-role-orchestrator"
  },
  "output": {
    "rawBytes": 0,
    "modelVisibleBytes": 199,
    "reducedBytes": 0,
    "estimatedRawTokens": 0,
    "estimatedModelVisibleTokens": 50,
    "estimatedTokensAvoided": 0,
    "tokenEstimate": {
      "method": "utf8_bytes_divided_by_4",
      "version": 1
    }
  },
  "evidence": {
    "ref": ".agent/logs/tool-03bc2fff-f0b2-495e-bec4-3be711f510f4.log",
    "sha256": "e3b0c44298fc1c149afbf4c8996fb92427ae41e4649b934ca495991b7852b855",
    "redaction": {
      "mode": "default",
      "count": 0
    }
  }
}
