{
  "schemaVersion": 3,
  "traceId": "5ac08df0-77ac-485a-935e-e53169f77a09",
  "runId": "verify-20260908T194743Z-64640",
  "taskId": "verify.shell",
  "providerId": "shell-linter",
  "tools": [
    "shellcheck"
  ],
  "executor": "pnpm",
  "startedAt": "2026-09-08T19:47:49Z",
  "startedAtEpochMs": 1788896869884,
  "durationMs": 784,
  "exitCode": 0,
  "context": {
    "repositoryId": "f1c573ec8d35a233",
    "worktreeId": "18180bae8c9a8c81",
    "branch": "independent-roles",
    "candidateRevision": "ebbb91112a93f2590e766ae990dec74bfbd77267",
    "workspaceDigest": "sha256:e3b0c44298fc1c149afbf4c8996fb92427ae41e4649b934ca495991b7852b855",
    "dirty": false,
    "agentId": "codex-role-orchestrator"
  },
  "output": {
    "rawBytes": 741,
    "modelVisibleBytes": 206,
    "reducedBytes": 535,
    "estimatedRawTokens": 186,
    "estimatedModelVisibleTokens": 52,
    "estimatedTokensAvoided": 134,
    "tokenEstimate": {
      "method": "utf8_bytes_divided_by_4",
      "version": 1
    }
  },
  "evidence": {
    "ref": ".agent/logs/tool-5ac08df0-77ac-485a-935e-e53169f77a09.log",
    "sha256": "cbb0a0c7d3a571ced2fe995f55a397a179e6def94470ea20b844eb1734b4faa4",
    "redaction": {
      "mode": "default",
      "count": 0
    }
  }
}
