{
  "schemaVersion": 3,
  "traceId": "52aff4b8-926b-40ef-a7c6-d5e5c357a8ee",
  "runId": "verify-20260909T182920Z-49273",
  "taskId": "verify.lsp",
  "providerId": "language-server",
  "tools": [
    "scripts/lsp-query.mjs",
    "typescript-language-server",
    "gopls"
  ],
  "executor": "pnpm",
  "startedAt": "2026-09-09T18:30:03Z",
  "startedAtEpochMs": 1788978603150,
  "durationMs": 2343,
  "exitCode": 0,
  "context": {
    "repositoryId": "f1c573ec8d35a233",
    "worktreeId": "18180bae8c9a8c81",
    "branch": "independent-roles",
    "candidateRevision": "d9c57b232fe5a3bd8f6479087ab359a5a2aa0a46",
    "workspaceDigest": "sha256:e3b0c44298fc1c149afbf4c8996fb92427ae41e4649b934ca495991b7852b855",
    "dirty": false,
    "agentId": "codex-role-orchestrator"
  },
  "output": {
    "rawBytes": 171,
    "modelVisibleBytes": 208,
    "reducedBytes": 0,
    "estimatedRawTokens": 43,
    "estimatedModelVisibleTokens": 52,
    "estimatedTokensAvoided": 0,
    "tokenEstimate": {
      "method": "utf8_bytes_divided_by_4",
      "version": 1
    }
  },
  "evidence": {
    "ref": ".agent/logs/tool-52aff4b8-926b-40ef-a7c6-d5e5c357a8ee.log",
    "sha256": "fecbd9cc73f9a7d560751b21bc5c57bf46da6b4904e9726c9c6b5137e0857204",
    "redaction": {
      "mode": "default",
      "count": 0
    }
  }
}
