{
  "schemaVersion": 3,
  "traceId": "e5ad4ee4-06b1-4825-80a4-dad51d1e6397",
  "runId": "verify-20260909T061255Z-95436",
  "taskId": "verify.structural",
  "providerId": "structural-analyzer",
  "tools": [
    "ast-grep"
  ],
  "executor": "pnpm",
  "startedAt": "2026-09-09T06:13:35Z",
  "startedAtEpochMs": 1788934415251,
  "durationMs": 314,
  "exitCode": 0,
  "context": {
    "repositoryId": "f1c573ec8d35a233",
    "worktreeId": "18180bae8c9a8c81",
    "branch": "independent-roles",
    "candidateRevision": "5e54ea2667efe32a3dea8cc4136fae0bd9a6c8fc",
    "workspaceDigest": "sha256:e3b0c44298fc1c149afbf4c8996fb92427ae41e4649b934ca495991b7852b855",
    "dirty": false,
    "agentId": "codex-role-orchestrator"
  },
  "output": {
    "rawBytes": 402,
    "modelVisibleBytes": 218,
    "reducedBytes": 184,
    "estimatedRawTokens": 101,
    "estimatedModelVisibleTokens": 55,
    "estimatedTokensAvoided": 46,
    "tokenEstimate": {
      "method": "utf8_bytes_divided_by_4",
      "version": 1
    }
  },
  "evidence": {
    "ref": ".agent/logs/tool-e5ad4ee4-06b1-4825-80a4-dad51d1e6397.log",
    "sha256": "0600d8feb81439e722eea1aec2f4cdb90ec92c03cc7baff2dbe7004349cb0ddb",
    "redaction": {
      "mode": "default",
      "count": 0
    }
  }
}
