{
  "schemaVersion": 3,
  "traceId": "3785bbcd-c69b-4ea3-b30d-5973396552cd",
  "runId": "verify-20260909T062623Z-4653",
  "taskId": "verify.structural",
  "providerId": "structural-analyzer",
  "tools": [
    "ast-grep"
  ],
  "executor": "pnpm",
  "startedAt": "2026-09-09T06:27:02Z",
  "startedAtEpochMs": 1788935222982,
  "durationMs": 313,
  "exitCode": 0,
  "context": {
    "repositoryId": "f1c573ec8d35a233",
    "worktreeId": "18180bae8c9a8c81",
    "branch": "independent-roles",
    "candidateRevision": "07b032802339b93d15a8a26963cd5ef834a3dbe6",
    "workspaceDigest": "sha256:e3b0c44298fc1c149afbf4c8996fb92427ae41e4649b934ca495991b7852b855",
    "dirty": false,
    "agentId": "codex-role-orchestrator"
  },
  "output": {
    "rawBytes": 402,
    "modelVisibleBytes": 218,
    "reducedBytes": 184,
    "estimatedRawTokens": 101,
    "estimatedModelVisibleTokens": 55,
    "estimatedTokensAvoided": 46,
    "tokenEstimate": {
      "method": "utf8_bytes_divided_by_4",
      "version": 1
    }
  },
  "evidence": {
    "ref": ".agent/logs/tool-3785bbcd-c69b-4ea3-b30d-5973396552cd.log",
    "sha256": "0600d8feb81439e722eea1aec2f4cdb90ec92c03cc7baff2dbe7004349cb0ddb",
    "redaction": {
      "mode": "default",
      "count": 0
    }
  }
}
