{
  "schemaVersion": 3,
  "traceId": "031f63de-f250-47a0-af20-972ebe93b537",
  "runId": "verify-20260909T182920Z-49273",
  "taskId": "verify.go-vet",
  "providerId": "go-vet",
  "tools": [
    "go-vet"
  ],
  "executor": "env",
  "startedAt": "2026-09-09T18:29:58Z",
  "startedAtEpochMs": 1788978598519,
  "durationMs": 174,
  "exitCode": 0,
  "context": {
    "repositoryId": "f1c573ec8d35a233",
    "worktreeId": "18180bae8c9a8c81",
    "branch": "independent-roles",
    "candidateRevision": "d9c57b232fe5a3bd8f6479087ab359a5a2aa0a46",
    "workspaceDigest": "sha256:e3b0c44298fc1c149afbf4c8996fb92427ae41e4649b934ca495991b7852b855",
    "dirty": false,
    "agentId": "codex-role-orchestrator"
  },
  "output": {
    "rawBytes": 0,
    "modelVisibleBytes": 199,
    "reducedBytes": 0,
    "estimatedRawTokens": 0,
    "estimatedModelVisibleTokens": 50,
    "estimatedTokensAvoided": 0,
    "tokenEstimate": {
      "method": "utf8_bytes_divided_by_4",
      "version": 1
    }
  },
  "evidence": {
    "ref": ".agent/logs/tool-031f63de-f250-47a0-af20-972ebe93b537.log",
    "sha256": "e3b0c44298fc1c149afbf4c8996fb92427ae41e4649b934ca495991b7852b855",
    "redaction": {
      "mode": "default",
      "count": 0
    }
  }
}
