{
  "schemaVersion": 3,
  "traceId": "441c9979-c19f-43e5-98c2-2535672295a0",
  "runId": "verify-20260908T194653Z-59928",
  "taskId": "verify.format",
  "providerId": "formatters",
  "tools": [
    "prettier",
    "gofmt"
  ],
  "executor": "pnpm",
  "startedAt": "2026-09-08T19:46:53Z",
  "startedAtEpochMs": 1788896813710,
  "durationMs": 1123,
  "exitCode": 0,
  "context": {
    "repositoryId": "f1c573ec8d35a233",
    "worktreeId": "18180bae8c9a8c81",
    "branch": "independent-roles",
    "candidateRevision": "ebbb91112a93f2590e766ae990dec74bfbd77267",
    "workspaceDigest": "sha256:e3b0c44298fc1c149afbf4c8996fb92427ae41e4649b934ca495991b7852b855",
    "dirty": false,
    "agentId": "codex-role-orchestrator"
  },
  "output": {
    "rawBytes": 391,
    "modelVisibleBytes": 206,
    "reducedBytes": 185,
    "estimatedRawTokens": 98,
    "estimatedModelVisibleTokens": 52,
    "estimatedTokensAvoided": 46,
    "tokenEstimate": {
      "method": "utf8_bytes_divided_by_4",
      "version": 1
    }
  },
  "evidence": {
    "ref": ".agent/logs/tool-441c9979-c19f-43e5-98c2-2535672295a0.log",
    "sha256": "5eb2fcbe8a8bb0e6246c83bedb5e321a080fdbc900be3da53668125559487232",
    "redaction": {
      "mode": "default",
      "count": 0
    }
  }
}
