{
  "schemaVersion": 3,
  "traceId": "422e28f9-a539-4bbc-85cb-78a3f9119d20",
  "runId": "verify-20260909T061255Z-95436",
  "taskId": "verify.format",
  "providerId": "formatters",
  "tools": [
    "prettier",
    "gofmt"
  ],
  "executor": "pnpm",
  "startedAt": "2026-09-09T06:12:55Z",
  "startedAtEpochMs": 1788934375307,
  "durationMs": 1162,
  "exitCode": 0,
  "context": {
    "repositoryId": "f1c573ec8d35a233",
    "worktreeId": "18180bae8c9a8c81",
    "branch": "independent-roles",
    "candidateRevision": "5e54ea2667efe32a3dea8cc4136fae0bd9a6c8fc",
    "workspaceDigest": "sha256:e3b0c44298fc1c149afbf4c8996fb92427ae41e4649b934ca495991b7852b855",
    "dirty": false,
    "agentId": "codex-role-orchestrator"
  },
  "output": {
    "rawBytes": 391,
    "modelVisibleBytes": 206,
    "reducedBytes": 185,
    "estimatedRawTokens": 98,
    "estimatedModelVisibleTokens": 52,
    "estimatedTokensAvoided": 46,
    "tokenEstimate": {
      "method": "utf8_bytes_divided_by_4",
      "version": 1
    }
  },
  "evidence": {
    "ref": ".agent/logs/tool-422e28f9-a539-4bbc-85cb-78a3f9119d20.log",
    "sha256": "5eb2fcbe8a8bb0e6246c83bedb5e321a080fdbc900be3da53668125559487232",
    "redaction": {
      "mode": "default",
      "count": 0
    }
  }
}
