{
  "schemaVersion": 3,
  "traceId": "7a20039f-423d-47aa-aa71-3b2260bf732d",
  "runId": "verify-20260909T182920Z-49273",
  "taskId": "verify.integration",
  "providerId": "integration-runner",
  "tools": [
    "node",
    "go"
  ],
  "executor": "pnpm",
  "startedAt": "2026-09-09T18:29:58Z",
  "startedAtEpochMs": 1788978598818,
  "durationMs": 4214,
  "exitCode": 0,
  "context": {
    "repositoryId": "f1c573ec8d35a233",
    "worktreeId": "18180bae8c9a8c81",
    "branch": "independent-roles",
    "candidateRevision": "d9c57b232fe5a3bd8f6479087ab359a5a2aa0a46",
    "workspaceDigest": "sha256:e3b0c44298fc1c149afbf4c8996fb92427ae41e4649b934ca495991b7852b855",
    "dirty": false,
    "agentId": "codex-role-orchestrator"
  },
  "output": {
    "rawBytes": 319,
    "modelVisibleBytes": 219,
    "reducedBytes": 100,
    "estimatedRawTokens": 80,
    "estimatedModelVisibleTokens": 55,
    "estimatedTokensAvoided": 25,
    "tokenEstimate": {
      "method": "utf8_bytes_divided_by_4",
      "version": 1
    }
  },
  "evidence": {
    "ref": ".agent/logs/tool-7a20039f-423d-47aa-aa71-3b2260bf732d.log",
    "sha256": "15db5e875436bd396cb8eb330ae141828eb424a88ff4ce0b85575b9b5ae0a8fd",
    "redaction": {
      "mode": "default",
      "count": 0
    }
  }
}
