{
  "schemaVersion": 3,
  "traceId": "3aa96f50-36df-4287-9f9f-9ae88a4f6242",
  "runId": "verify-20260909T061255Z-95436",
  "taskId": "verify.shell",
  "providerId": "shell-linter",
  "tools": [
    "shellcheck"
  ],
  "executor": "pnpm",
  "startedAt": "2026-09-09T06:13:01Z",
  "startedAtEpochMs": 1788934381365,
  "durationMs": 721,
  "exitCode": 0,
  "context": {
    "repositoryId": "f1c573ec8d35a233",
    "worktreeId": "18180bae8c9a8c81",
    "branch": "independent-roles",
    "candidateRevision": "5e54ea2667efe32a3dea8cc4136fae0bd9a6c8fc",
    "workspaceDigest": "sha256:e3b0c44298fc1c149afbf4c8996fb92427ae41e4649b934ca495991b7852b855",
    "dirty": false,
    "agentId": "codex-role-orchestrator"
  },
  "output": {
    "rawBytes": 741,
    "modelVisibleBytes": 206,
    "reducedBytes": 535,
    "estimatedRawTokens": 186,
    "estimatedModelVisibleTokens": 52,
    "estimatedTokensAvoided": 134,
    "tokenEstimate": {
      "method": "utf8_bytes_divided_by_4",
      "version": 1
    }
  },
  "evidence": {
    "ref": ".agent/logs/tool-3aa96f50-36df-4287-9f9f-9ae88a4f6242.log",
    "sha256": "cbb0a0c7d3a571ced2fe995f55a397a179e6def94470ea20b844eb1734b4faa4",
    "redaction": {
      "mode": "default",
      "count": 0
    }
  }
}
